{
  "$schema": "https://json-schema.org/draft/2020-12/schema",
  "$id": "https://voyager.nagi.fun/plugin.schema.json",
  "title": "Voyager plugin manifest",
  "description": "A declarative Voyager plugin (plugin.json). Hand-written to mirror the gates, which are the authority: this schema is editor tooling. A bundled plugin goes through `bun run plugin:check <dir>` (the site it ships under, the primitives this build carries, translation completeness). A local plugin goes through the popup import; `npx create-voyager-plugin check <dir>` runs the same checks offline, including the local-only rules no schema can express: `matches` must stay inside a site Voyager supports, every semantic key must be declared by every matched site, Gemini and AI Studio take no `theme` and no `native` op, and settings are boolean, number or select only. Unknown top-level keys are ignored rather than rejected, exactly as the validators ignore them.",
  "type": "object",
  "required": [
    "id",
    "name",
    "version",
    "description",
    "author",
    "category",
    "license",
    "engine",
    "tier",
    "matches",
    "contributes"
  ],
  "properties": {
    "$schema": {
      "type": "string",
      "description": "This schema's URL, so editors validate the file as you type."
    },
    "id": {
      "type": "string",
      "minLength": 1,
      "description": "Globally unique, reverse-dotted (e.g. `voyager.claude-reading-width`). A local plugin is stored as `local.<id>`; write the id without that prefix."
    },
    "name": {
      "type": "string",
      "minLength": 1,
      "description": "Display name: English for a bundled plugin, any language for a local one."
    },
    "version": {
      "type": "string",
      "minLength": 1,
      "description": "Semver of the plugin itself (e.g. `1.2.0`)."
    },
    "description": {
      "type": "string",
      "minLength": 1,
      "description": "One-liner shown in the popup: English for a bundled plugin, any language for a local one."
    },
    "author": { "type": "string", "minLength": 1 },
    "category": {
      "type": "string",
      "minLength": 1,
      "description": "Classification. The known set is render-fix, theme, layout, readability, productivity, integration, other; any string is accepted so third parties are not boxed in.",
      "examples": [
        "render-fix",
        "theme",
        "layout",
        "readability",
        "productivity",
        "integration",
        "other"
      ]
    },
    "license": {
      "type": "string",
      "minLength": 1,
      "description": "SPDX expression (e.g. `MIT`, `GPL-3.0-or-later`, `Proprietary`)."
    },
    "homepage": { "type": "string", "description": "Optional URL documenting the plugin." },
    "engine": {
      "type": "string",
      "minLength": 1,
      "description": "Semver range the plugin needs of the host engine: `*`, an exact `x.y.z`, or `>=x.y.z`. Repository contributors may use `>=next` for an unreleased primitive or capability; catalog publishing resolves it to a concrete version. Local imports require a concrete version. A plugin that invokes a primitive must set a floor at or above that primitive's `sinceEngine`; settings tokens in native params also require engine 1.8.0 or later. These floors make an older Voyager say \"update Voyager\" instead of silently misinterpreting params or reporting a missing handler.",
      "examples": [">=1.2.0", ">=1.3.0"]
    },
    "tier": {
      "type": "string",
      "enum": ["declarative", "scripted"],
      "description": "`declarative` ships only data (CSS + JSON) interpreted by the bundled engine. `scripted` is reserved for a later advanced tier; the v1 engine applies only its declarative contributions."
    },
    "matches": {
      "type": "array",
      "minItems": 1,
      "items": { "type": "string", "minLength": 1 },
      "description": "URL match patterns the plugin applies to. A bundled plugin must stay inside the matches of the site it ships under (plan D18), a local plugin inside the matches of a site Voyager supports. The gates enforce that; this schema cannot.",
      "examples": [["https://claude.ai/*"]]
    },
    "contributes": { "$ref": "#/$defs/contributions" },
    "theme": {
      "type": "object",
      "required": ["brand"],
      "properties": {
        "brand": {
          "$ref": "#/$defs/hexColor",
          "description": "Accent for Voyager's own UI on the matched site(s); overrides the site adapter's brandColor. Hex only — the value is concatenated into a CSS `color-mix(...)` expression."
        }
      },
      "description": "Optional brand accent contributed for the matched site(s). Not allowed on Gemini or AI Studio."
    },
    "format": {
      "const": 1,
      "description": "Manifest format major. Absent means 1; published host catalogs always carry it."
    },
    "requires": {
      "type": "object",
      "description": "What the plugin needs from the host beyond the engine range. A miss disables the plugin with a reason (needs-handler / needs-semantic) instead of hiding it.",
      "properties": {
        "handlers": {
          "type": "array",
          "maxItems": 50,
          "items": {
            "type": "string",
            "minLength": 1,
            "maxLength": 100,
            "pattern": "^[a-z][a-zA-Z0-9]{1,39}$",
            "enum": [
              "codeCollapse",
              "collapse",
              "copyButton",
              "echarts",
              "formulaCopy",
              "mermaid",
              "tableCopy",
              "turnNavigator",
              "userLatex",
              "vimInput",
              "wavedrom"
            ]
          },
          "description": "Primitive names the plugin invokes. Optional: a `native` op already implies its handler, so list one only to state the dependency explicitly."
        },
        "semantic": {
          "type": "array",
          "maxItems": 50,
          "items": {
            "type": "string",
            "minLength": 1,
            "maxLength": 100,
            "enum": [
              "userTurn",
              "assistantTurn",
              "thinkingBlock",
              "codeBlock",
              "composer",
              "sidebar",
              "sidePanel",
              "headerActions",
              "scrollContainer",
              "composerRoot",
              "sendButton"
            ]
          },
          "description": "Semantic selector keys the plugin expects its site adapter to define (see site.schema.json). Every matched site must declare each one."
        }
      }
    },
    "changelog": {
      "type": "string",
      "minLength": 1,
      "maxLength": 500,
      "description": "One line describing this version, shown in the popup. When set, every locale in `i18n` needs a translated `changelog` too."
    },
    "i18n": {
      "type": "object",
      "description": "Localized metadata keyed by app language code. `en` is not needed — the top-level fields are the English copy, and every field falls back to them individually. `plugin:check` requires name and description (plus changelog and every setting label, when present) for ar, es, fr, ja, ko, pt, ru, zh and zh_TW in a bundled plugin; a local plugin may leave `i18n` out.",
      "additionalProperties": { "$ref": "#/$defs/localization" }
    }
  },
  "$defs": {
    "hexColor": {
      "type": "string",
      "pattern": "^#(?:[0-9a-fA-F]{3}|[0-9a-fA-F]{4}|[0-9a-fA-F]{6}|[0-9a-fA-F]{8})$",
      "description": "A strict hex literal (3, 4, 6 or 8 digits), e.g. `#d97757`.",
      "examples": ["#d97757"]
    },
    "contributions": {
      "type": "object",
      "description": "Everything the plugin adds to the page. New capabilities arrive as new keys here — a plugin never runs code of its own.",
      "properties": {
        "styles": {
          "type": "array",
          "items": { "$ref": "#/$defs/styleContribution" }
        },
        "domOps": {
          "type": "array",
          "maxItems": 500,
          "items": { "$ref": "#/$defs/domOperation" }
        },
        "settings": {
          "type": "object",
          "description": "User-configurable settings, rendered by the popup. A `{{key}}` token in CSS text, a setStyle value, a setAttribute value or a native params string is replaced with the current value (the default until the user changes it). Native params tokens require engine 1.8.0 or later. A local plugin may use boolean, number and select settings only: the popup has no control for string or color yet.",
          "additionalProperties": { "$ref": "#/$defs/settingField" }
        }
      }
    },
    "styleContribution": {
      "description": "CSS injected as a <style> element. Authors write `{ \"file\": \"style.css\" }`; the build (or the popup's Import files) inlines it as `{ \"css\": \"…\" }`, which is the form published catalogs carry. Scope rules under the plugin's own `gv-` classes; `{{key}}` setting tokens are substituted. CSS may not load anything: no `@import`, `image-set()`, `image()`, `cross-fade()` or `src()`, and `url()` only with a `#fragment` or a raster-image `data:` URI (png, jpeg, gif, webp, avif, bmp, ico; never SVG).",
      "anyOf": [
        {
          "type": "object",
          "required": ["file"],
          "properties": {
            "file": {
              "type": "string",
              "pattern": "\\.css$",
              "description": "Path to a .css file beside plugin.json. Relative, no `..`, no query or fragment."
            }
          }
        },
        {
          "type": "object",
          "required": ["css"],
          "properties": {
            "css": { "type": "string", "maxLength": 200000 },
            "source": {
              "type": "string",
              "description": "The style file the CSS was inlined from. Written by the build."
            }
          }
        }
      ]
    },
    "selectorRef": {
      "description": "Where an operation applies: a bare CSS selector string (sugar for `{\"kind\":\"css\"}`), an explicit css ref, or a semantic key the site adapter maps to a site-specific selector. Prefer semantic keys — a site redesign is then a one-file adapter fix.",
      "anyOf": [
        { "type": "string", "minLength": 1 },
        {
          "type": "object",
          "required": ["kind", "selector"],
          "properties": {
            "kind": { "const": "css" },
            "selector": { "type": "string", "minLength": 1 }
          }
        },
        {
          "type": "object",
          "required": ["kind", "key"],
          "properties": {
            "kind": { "const": "semantic" },
            "key": {
              "type": "string",
              "enum": [
                "userTurn",
                "assistantTurn",
                "thinkingBlock",
                "codeBlock",
                "composer",
                "sidebar",
                "sidePanel",
                "headerActions",
                "scrollContainer",
                "composerRoot",
                "sendButton"
              ],
              "description": "A semantic key every matched site declares (see site.schema.json)."
            }
          }
        }
      ]
    },
    "domOperation": {
      "description": "One reversible DOM operation interpreted by the bundled engine.",
      "oneOf": [
        {
          "type": "object",
          "title": "addClass",
          "required": ["op", "target", "className"],
          "properties": {
            "op": { "const": "addClass" },
            "target": { "$ref": "#/$defs/selectorRef" },
            "className": {
              "type": "string",
              "pattern": "^gv-[A-Za-z0-9_-]+$",
              "description": "Exactly one class name starting with `gv-`, conventionally `gv-plugin-<plugin>`. Style it in `contributes.styles`."
            }
          }
        },
        {
          "type": "object",
          "title": "setAttribute",
          "required": ["op", "target", "name", "value"],
          "properties": {
            "op": { "const": "setAttribute" },
            "target": { "$ref": "#/$defs/selectorRef" },
            "name": {
              "type": "string",
              "pattern": "^(?:title|role|lang|dir|hidden|tabindex|draggable|spellcheck|translate|style|data-[a-z0-9][a-z0-9._-]*|aria-[a-z]+)$",
              "description": "An inert attribute: data-*, aria-*, or one of title, role, lang, dir, hidden, tabindex, draggable, spellcheck, translate, style. Never href, src, on*, class or id."
            },
            "value": {
              "type": "string",
              "description": "May not contain an external URL; a `style` value follows the setStyle rules. `{{key}}` setting tokens are substituted."
            }
          }
        },
        {
          "type": "object",
          "title": "setStyle",
          "required": ["op", "target", "styles"],
          "properties": {
            "op": { "const": "setStyle" },
            "target": { "$ref": "#/$defs/selectorRef" },
            "styles": {
              "type": "object",
              "description": "CSS property → value, custom properties included. Anything that loads (a url() other than a raster-image data: URI or #fragment, image-set(), …) is rejected. `{{key}}` setting tokens are substituted.",
              "additionalProperties": { "type": "string" }
            }
          }
        },
        {
          "type": "object",
          "title": "hide",
          "required": ["op", "target"],
          "properties": {
            "op": { "const": "hide" },
            "target": { "$ref": "#/$defs/selectorRef" }
          }
        },
        {
          "type": "object",
          "title": "native",
          "description": "Invoke a first-party primitive by name. `params` is configuration, never instructions; the primitive validates its own params. The engine floor must clear the primitive's sinceEngine, and every matched site must declare the semantic keys it reads: the gates enforce both. A local plugin may not use it on Gemini or AI Studio.",
          "required": ["op", "handler"],
          "properties": {
            "op": { "const": "native" },
            "handler": {
              "type": "string",
              "pattern": "^[a-z][a-zA-Z0-9]{1,39}$",
              "enum": [
                "codeCollapse",
                "collapse",
                "copyButton",
                "echarts",
                "formulaCopy",
                "mermaid",
                "tableCopy",
                "turnNavigator",
                "userLatex",
                "vimInput",
                "wavedrom"
              ],
              "description": "A primitive this Voyager build ships (src/features/plugins/verbs/contracts.ts)."
            },
            "params": {
              "type": "object",
              "description": "Plain JSON configuration: primitives, arrays and objects of those, at most 4 levels deep, 50 keys or entries per level and 2000 chars per string. String values recursively support {{settingKey}} tokens; parameter names and object keys stay literal. A whole-value token preserves the setting's number, boolean or string type; embedded tokens produce a string. Expansion runs once, so tokens inside setting values remain literal. Every referenced key must exist in contributes.settings and its type must fit the primitive contract wherever statically knowable. Loading checks substituted defaults; each activation substitutes resolved stored values and runs the primitive's validateParams, skipping an invalid op through the same diagnostic path as invalid static params. Settings changes serialize disposal and reactivation for templated ops; static params keep in-place updates. Requires engine 1.8.0 or later, plus any higher primitive/param floor; catalog authors use >=next while the capability is unreleased, local imports use concrete versions.",
              "additionalProperties": true
            }
          }
        }
      ]
    },
    "settingField": {
      "type": "object",
      "required": ["type", "label", "default"],
      "properties": {
        "type": {
          "type": "string",
          "enum": ["boolean", "number", "string", "color", "select"],
          "description": "string and color are for bundled plugins only; a local plugin may use boolean, number or select."
        },
        "label": {
          "type": "string",
          "minLength": 1,
          "description": "English label. Every locale needs a translation under `i18n.<locale>.settings.<key>.label`."
        },
        "default": { "type": ["boolean", "number", "string"] },
        "enabledBy": {
          "type": "string",
          "minLength": 1,
          "description": "Key of another boolean setting in this plugin. The popup keeps this control visible with its value, but disables it unless that boolean's resolved value is true. The gate checks that the key is non-empty, names a boolean in the same schema and is not this field; the target must have no enabledBy of its own (one level only)."
        },
        "minLabel": {
          "type": "string",
          "minLength": 1,
          "maxLength": 500,
          "description": "Label for the low end of a number/range control."
        },
        "maxLabel": {
          "type": "string",
          "minLength": 1,
          "maxLength": 500,
          "description": "Label for the high end of a number/range control."
        },
        "min": { "type": "number" },
        "max": { "type": "number" },
        "options": {
          "type": "array",
          "description": "Choices for a `select` setting: at least one, with unique values; `default` must be one of them.",
          "items": {
            "type": "object",
            "required": ["value", "label"],
            "properties": {
              "value": { "type": "string" },
              "label": { "type": "string" }
            }
          }
        }
      },
      "if": { "properties": { "type": { "const": "select" } } },
      "then": {
        "required": ["options"],
        "properties": {
          "default": { "type": "string" },
          "options": { "minItems": 1 }
        }
      }
    },
    "localization": {
      "type": "object",
      "description": "One locale's copy. Every field is optional and falls back to the English original on its own.",
      "properties": {
        "name": { "type": "string", "minLength": 1, "maxLength": 500 },
        "description": { "type": "string", "minLength": 1, "maxLength": 500 },
        "changelog": { "type": "string", "minLength": 1, "maxLength": 500 },
        "settings": {
          "type": "object",
          "description": "Setting key → localized labels.",
          "additionalProperties": {
            "type": "object",
            "properties": {
              "label": { "type": "string", "minLength": 1, "maxLength": 500 },
              "minLabel": { "type": "string", "minLength": 1, "maxLength": 500 },
              "maxLabel": { "type": "string", "minLength": 1, "maxLength": 500 },
              "options": {
                "type": "object",
                "description": "Select option value → localized label.",
                "additionalProperties": { "type": "string", "minLength": 1, "maxLength": 500 }
              }
            }
          }
        }
      }
    }
  }
}
