{
  "$schema": "https://voyager.nagi.fun/plugin.schema.json",
  "id": "voyager.deepseek-wrap-code",
  "name": "DeepSeek · Code wrapping",
  "version": "1.0.0",
  "description": "Long code lines scroll sideways instead of wrapping, so indentation survives. Turn wrapping back on whenever you prefer it.",
  "i18n": {
    "zh": {
      "name": "DeepSeek · 代码换行",
      "description": "长代码行横向滚动而不是折行，缩进和对齐都保住；想折行也有开关。",
      "settings": {
        "wrapCode": {
          "label": "代码自动换行"
        }
      }
    },
    "zh_TW": {
      "name": "DeepSeek · 程式碼換行",
      "description": "長的程式碼行橫向捲動而不是折行，縮排和對齊都保住；想折行也有開關。",
      "settings": {
        "wrapCode": {
          "label": "程式碼自動換行"
        }
      }
    },
    "ja": {
      "name": "DeepSeek · コードの折り返し",
      "description": "長いコード行は折り返さず横スクロールするので、インデントが崩れません。折り返しに戻すこともできます。",
      "settings": {
        "wrapCode": {
          "label": "コードを折り返す"
        }
      }
    },
    "ko": {
      "name": "DeepSeek · 코드 줄바꿈",
      "description": "긴 코드 줄이 줄바꿈 대신 가로로 스크롤되어 들여쓰기가 유지됩니다. 원하면 줄바꿈으로 되돌릴 수 있습니다.",
      "settings": {
        "wrapCode": {
          "label": "코드 줄바꿈"
        }
      }
    },
    "fr": {
      "name": "DeepSeek · Retour à la ligne du code",
      "description": "Les longues lignes de code défilent horizontalement au lieu de passer à la ligne, donc l'indentation est préservée. Réactivez le retour à la ligne quand vous le préférez.",
      "settings": {
        "wrapCode": {
          "label": "Retour à la ligne du code"
        }
      }
    },
    "es": {
      "name": "DeepSeek · Ajuste de líneas de código",
      "description": "Las líneas largas de código se desplazan en horizontal en vez de ajustarse, así se conserva la sangría. Puedes volver a activar el ajuste cuando quieras.",
      "settings": {
        "wrapCode": {
          "label": "Ajustar líneas de código"
        }
      }
    },
    "pt": {
      "name": "DeepSeek · Quebra de linhas de código",
      "description": "As linhas longas de código rolam na horizontal em vez de quebrar, preservando a indentação. Dá para voltar a quebrar quando preferir.",
      "settings": {
        "wrapCode": {
          "label": "Quebrar linhas de código"
        }
      }
    },
    "ru": {
      "name": "DeepSeek · Перенос строк кода",
      "description": "Длинные строки кода прокручиваются по горизонтали вместо переноса, отступы сохраняются. Перенос можно включить обратно.",
      "settings": {
        "wrapCode": {
          "label": "Переносить строки кода"
        }
      }
    },
    "ar": {
      "name": "DeepSeek · التفاف الشيفرة",
      "description": "أسطر الشيفرة الطويلة تُمرَّر أفقيًا بدل أن تلتف، فتبقى المسافات البادئة سليمة. ويمكنك إعادة تفعيل الالتفاف متى شئت.",
      "settings": {
        "wrapCode": {
          "label": "التفاف أسطر الشيفرة"
        }
      }
    }
  },
  "author": "voyager-official",
  "category": "readability",
  "license": "MIT",
  "homepage": "https://github.com/voyager-crew/voyager/tree/main/src/features/plugins/catalog/sites/deepseek/plugins/wrap-code",
  "engine": ">=1.4.0",
  "tier": "declarative",
  "matches": ["https://chat.deepseek.com/*"],
  "requires": {
    "semantic": ["assistantTurn"]
  },
  "contributes": {
    "settings": {
      "wrapCode": {
        "type": "boolean",
        "label": "Wrap code lines",
        "default": false
      }
    },
    "styles": [
      {
        "file": "style.css"
      }
    ],
    "domOps": [
      {
        "op": "addClass",
        "target": {
          "kind": "semantic",
          "key": "assistantTurn"
        },
        "className": "gv-plugin-deepseek-wrap-code"
      },
      {
        "op": "setAttribute",
        "target": {
          "kind": "semantic",
          "key": "assistantTurn"
        },
        "name": "data-gv-code-wrap",
        "value": "{{wrapCode}}"
      }
    ]
  }
}
