{
  "$schema": "https://voyager.nagi.fun/plugin.schema.json",
  "id": "voyager.gemini-formula-copy",
  "name": "Gemini · Formula Copy",
  "version": "1.0.0",
  "description": "Click an inline or block formula to copy it in the format chosen below; hover shows it's clickable.",
  "changelog": "First release: Gemini's built-in formula copy, packaged as an official plugin that calls the formulaCopy primitive.",
  "i18n": {
    "zh": {
      "name": "Gemini · 公式复制",
      "description": "点击行内或块级公式，按下方选定的格式复制；悬停时会提示可点击。",
      "changelog": "首个版本：将 Gemini 内置的公式复制打包为调用 formulaCopy 原语的官方插件。"
    },
    "zh_TW": {
      "name": "Gemini · 公式複製",
      "description": "點擊行內或區塊公式，依下方選定的格式複製；滑鼠懸停時會提示可點擊。",
      "changelog": "首個版本：將 Gemini 內建的公式複製打包為呼叫 formulaCopy 原語的官方外掛。"
    },
    "ja": {
      "name": "Gemini · 数式コピー",
      "description": "インラインまたはブロック数式をクリックすると、下で選んだ形式でコピーします。ホバーするとクリック可能であることが分かります。",
      "changelog": "初版：Gemini 内蔵の数式コピーを、formulaCopy プリミティブを呼び出す公式プラグインとして同梱しました。"
    },
    "ko": {
      "name": "Gemini · 수식 복사",
      "description": "인라인 또는 블록 수식을 클릭하면 아래에서 고른 형식으로 복사합니다. 마우스를 올리면 클릭 가능함을 표시합니다.",
      "changelog": "첫 릴리스: Gemini 내장 수식 복사를 formulaCopy 프리미티브를 호출하는 공식 플러그인으로 포함했습니다."
    },
    "fr": {
      "name": "Gemini · Copie de formules",
      "description": "Cliquez sur une formule en ligne ou en bloc pour la copier dans le format choisi ci-dessous ; le survol indique qu'elle est cliquable.",
      "changelog": "Première version : la copie de formules intégrée à Gemini, livrée comme plugin officiel qui appelle la primitive formulaCopy."
    },
    "es": {
      "name": "Gemini · Copia de fórmulas",
      "description": "Haz clic en una fórmula en línea o en bloque para copiarla en el formato elegido abajo; al pasar el cursor se muestra que se puede hacer clic.",
      "changelog": "Primera versión: la copia de fórmulas integrada de Gemini, incluida como plugin oficial que llama a la primitiva formulaCopy."
    },
    "pt": {
      "name": "Gemini · Cópia de fórmulas",
      "description": "Clique em uma fórmula inline ou em bloco para copiá-la no formato escolhido abaixo; ao passar o cursor, ela indica que pode ser clicada.",
      "changelog": "Primeira versão: a cópia de fórmulas integrada do Gemini, incluída como plugin oficial que chama a primitiva formulaCopy."
    },
    "ru": {
      "name": "Gemini · Копирование формул",
      "description": "Нажмите на строчную или блочную формулу, чтобы скопировать её в формате, выбранном ниже; при наведении видно, что её можно нажать.",
      "changelog": "Первая версия: встроенное копирование формул Gemini, поставляемое как официальный плагин, который вызывает примитив formulaCopy."
    },
    "ar": {
      "name": "Gemini · نسخ الصيغ",
      "description": "انقر على صيغة مضمنة أو كتلية لنسخها بالتنسيق المختار أدناه؛ ويظهر عند التحويم أنها قابلة للنقر.",
      "changelog": "الإصدار الأول: نسخ الصيغ المدمج في Gemini، مضمّنًا كإضافة رسمية تستدعي الأساسية formulaCopy."
    }
  },
  "author": "voyager-official",
  "category": "productivity",
  "license": "GPL-3.0-or-later",
  "homepage": "https://github.com/voyager-crew/voyager/tree/main/src/features/plugins/catalog/sites/gemini/plugins/formula-copy",
  "engine": ">=1.3.0",
  "tier": "declarative",
  "matches": ["https://gemini.google.com/*"],
  "requires": {
    "handlers": ["formulaCopy"]
  },
  "contributes": {
    "domOps": [
      {
        "op": "native",
        "handler": "formulaCopy",
        "params": {}
      }
    ]
  }
}
